{"schema":"chaessi-scene-plan/v2","request":"고급 호텔 로비에서 근무하는 여성 직원 한 명의 세련된 광고 화보 6장. 같은 인물과 의상, 장소를 유지하면서 구도와 행동을 의미 있게 변화시킨다.","mode":"editorial","count":6,"presetSelections":{"basePresetId":"preset_benchmark_v5","characterPresetIds":["character_aria"],"outfitPresetIds":["outfit_hotel_uniform"],"stylePresetId":"style_benchmark_editorial","qualityPresetId":"quality_benchmark_v5","cameraPresetId":null,"lightingPresetId":null},"continuity":{"characterIdentity":"locked","outfit":"locked","location":"locked","props":"locked","screenDirection":"locked"},"shots":[{"id":"shot_001","index":1,"intent":"호텔 로비의 고급스러운 규모와 직원의 단정한 존재감을 소개한다.","rhythmRole":"establishing","direction":{"shotSize":"wide","cameraHeight":"eye level","cameraAngle":"straight-on","viewpoint":"lobby entrance viewpoint","bodyOrientation":"three-quarter toward camera","pose":"upright with relaxed shoulders","action":"The employee stands beside the reception desk.","gaze":"toward camera","expression":"composed, welcoming","subjectPlacement":"centered lower frame","depth":"deep depth with layered lobby architecture","lighting":"soft daylight across marble surfaces with warm chandelier glow","visibilityRequirements":["full outfit silhouette","reception desk","recognizable hotel lobby architecture"]},"continuity":{"location":"same luxury hotel lobby","outfitState":"unchanged hotel uniform","props":[],"screenDirection":"facing toward the lobby entrance","carriesFrom":null},"generation":{"mainPrompt":"luxury hotel lobby, marble floor, reception desk, tall windows, warm chandeliers, editorial advertising composition, soft daylight and warm interior light","supplement":"The reception desk sits behind the subject with open floor space in front.","characters":[{"characterPresetId":"character_aria","visibleFeaturesPrompt":"","scenePrompt":"standing beside the reception desk, three-quarter pose toward camera, hands relaxed at the sides, centered in the lower frame","undesiredPrompt":"","position":{"x":0.5,"y":0.62}}],"undesiredPrompt":"","seed":null}},{"id":"shot_002","index":2,"intent":"로비를 가로지르는 자연스러운 이동으로 서비스의 활기를 보여준다.","rhythmRole":"action","direction":{"shotSize":"full-body","cameraHeight":"waist level","cameraAngle":"slight low angle","viewpoint":"side corridor viewpoint","bodyOrientation":"profile moving left to right","pose":"mid-stride","action":"The employee walks across the marble floor while carrying a single room-key folder.","gaze":"ahead along the walking path","expression":"focused, calm","subjectPlacement":"left third","depth":"moderate depth with the reception area softly behind","lighting":"window light creates a subtle rim along the moving silhouette","visibilityRequirements":["full walking stride","room-key folder","clear hand-to-folder contact"]},"continuity":{"location":"same luxury hotel lobby","outfitState":"unchanged hotel uniform","props":[{"id":"room_key_folder","state":"held in the near hand while walking"}],"screenDirection":"moving left to right","carriesFrom":null},"generation":{"mainPrompt":"luxury hotel lobby, marble floor, reception area, tall windows, warm chandeliers, editorial advertising composition, daylight rim light","supplement":"One hand holds a room-key folder at hip height while the other arm swings naturally.","characters":[{"characterPresetId":"character_aria","visibleFeaturesPrompt":"","scenePrompt":"walking left to right across the marble floor, profile view, carrying one room-key folder at hip height, placed on the left third","undesiredPrompt":"","position":{"x":0.28,"y":0.66}}],"undesiredPrompt":"","seed":null}},{"id":"shot_003","index":3,"intent":"리셉션 데스크에서 정교한 손동작과 친절한 서비스 태도를 강조한다.","rhythmRole":"service","direction":{"shotSize":"medium","cameraHeight":"chest level","cameraAngle":"three-quarter angle","viewpoint":"reception-side viewpoint","bodyOrientation":"three-quarter toward the desk","pose":"slight forward lean","action":"The employee places a room-key folder neatly on the reception counter.","gaze":"down toward the folder","expression":"attentive, gentle","subjectPlacement":"right third","depth":"shallow depth with lobby lights softened behind","lighting":"warm counter reflections illuminate the hands and lower face","visibilityRequirements":["both hands","room-key folder","counter contact point","visible attentive expression"]},"continuity":{"location":"same luxury hotel lobby","outfitState":"unchanged hotel uniform","props":[{"id":"room_key_folder","state":"resting on the reception counter under both hands"}],"screenDirection":"facing toward the reception counter","carriesFrom":null},"generation":{"mainPrompt":"luxury hotel lobby, polished reception counter, marble and brass details, warm chandeliers, editorial advertising composition, shallow depth of field","supplement":"Both hands rest on the room-key folder where it touches the polished counter.","characters":[{"characterPresetId":"character_aria","visibleFeaturesPrompt":"","scenePrompt":"leaning slightly toward the reception counter, placing a room-key folder with both hands, gaze lowered to the folder, positioned on the right third","undesiredPrompt":"","position":{"x":0.7,"y":0.56}}],"undesiredPrompt":"","seed":null}},{"id":"shot_004","index":4,"intent":"세련된 환대의 표정과 얼굴 중심의 인상을 만든다.","rhythmRole":"portrait","direction":{"shotSize":"close-up","cameraHeight":"eye level","cameraAngle":"slight high angle","viewpoint":"intimate portrait viewpoint","bodyOrientation":"head turned slightly left","pose":"still upright posture","action":"The employee pauses after completing the desk service.","gaze":"just past camera","expression":"confident, warm half-smile","subjectPlacement":"right half","depth":"very shallow depth with chandelier bokeh","lighting":"soft window-side key light with warm bokeh behind","visibilityRequirements":["eyes","facial expression","clean head-and-shoulders framing"]},"continuity":{"location":"same luxury hotel lobby","outfitState":"unchanged hotel uniform","props":[],"screenDirection":"head turned toward the left side of frame","carriesFrom":null},"generation":{"mainPrompt":"luxury hotel lobby, warm chandelier bokeh, soft window light, editorial advertising portrait, very shallow depth of field","supplement":"The background is reduced to warm chandelier bokeh behind the portrait.","characters":[{"characterPresetId":"character_aria","visibleFeaturesPrompt":"","scenePrompt":"head-and-shoulders portrait, head turned slightly left, looking just past camera with a confident warm half-smile, placed in the right half","undesiredPrompt":"","position":{"x":0.66,"y":0.37}}],"undesiredPrompt":"","seed":null}},{"id":"shot_005","index":5,"intent":"고급 마감재와 호텔 키의 디테일로 브랜드의 정돈감을 보여준다.","rhythmRole":"detail","direction":{"shotSize":"detail","cameraHeight":"counter height","cameraAngle":"top-down oblique angle","viewpoint":"close counter viewpoint","bodyOrientation":"hands angled diagonally across frame","pose":"precise hand arrangement","action":"The employee straightens a room-key folder beside a brass desk bell.","gaze":"out of frame","expression":"not visible","subjectPlacement":"lower center","depth":"extremely shallow depth across the counter surface","lighting":"warm reflected light glints on brass and the polished counter","visibilityRequirements":["hands","room-key folder","brass desk bell","clear separation between folder and bell"]},"continuity":{"location":"same luxury hotel lobby","outfitState":"unchanged hotel uniform","props":[{"id":"room_key_folder","state":"straightened on the reception counter"},{"id":"brass_desk_bell","state":"stationary beside the room-key folder"}],"screenDirection":"diagonal arrangement from lower left toward upper right","carriesFrom":null},"generation":{"mainPrompt":"polished hotel reception counter, brass desk bell, marble and brass details, warm reflected light, editorial advertising detail, extremely shallow depth of field","supplement":"Two hands straighten the room-key folder beside a stationary brass desk bell.","characters":[{"characterPresetId":"character_aria","visibleFeaturesPrompt":"","scenePrompt":"only hands and uniform sleeves visible, straightening a room-key folder beside a brass desk bell, diagonal arrangement across the lower center","undesiredPrompt":"","position":{"x":0.5,"y":0.72}}],"undesiredPrompt":"","seed":null}},{"id":"shot_006","index":6,"intent":"웅장한 창가에서 정면의 자신감 있는 마무리 이미지를 만든다.","rhythmRole":"hero","direction":{"shotSize":"cowboy","cameraHeight":"slightly below eye level","cameraAngle":"three-quarter low angle","viewpoint":"window-side viewpoint","bodyOrientation":"three-quarter toward camera","pose":"one hand lightly resting on the counter edge","action":"The employee turns from the window toward camera.","gaze":"directly toward camera","expression":"assured, welcoming smile","subjectPlacement":"left third","depth":"moderate depth with tall windows and chandeliers behind","lighting":"daylight backlight is balanced by warm reflected fill from the lobby","visibilityRequirements":["face","upper body","hand touching counter edge","tall window setting"]},"continuity":{"location":"same luxury hotel lobby","outfitState":"unchanged hotel uniform","props":[],"screenDirection":"turned from the window toward camera","carriesFrom":null},"generation":{"mainPrompt":"luxury hotel lobby, tall windows, marble floor, warm chandeliers, editorial advertising composition, balanced daylight backlight and warm reflected fill","supplement":"One hand touches the reception counter edge while tall windows remain visible behind.","characters":[{"characterPresetId":"character_aria","visibleFeaturesPrompt":"","scenePrompt":"turning from the window toward camera, three-quarter pose, one hand lightly resting on the reception counter edge, assured welcoming smile, placed on the left third","undesiredPrompt":"","position":{"x":0.3,"y":0.57}}],"undesiredPrompt":"","seed":null}}]}