{"schema":"chaessi-scene-plan/v2","request":"한 명의 여성 기록 보관 담당자가 조용한 기록실에 들어와 선반에서 장부를 꺼내고, 책상으로 옮겨 펼친 뒤 기록을 대조하고 메모를 남기는 6컷 연속 장면.","mode":"sequence","count":6,"presetSelections":{"basePresetId":"preset_benchmark_v5","characterPresetIds":["character_archivist"],"outfitPresetIds":["outfit_archivist"],"stylePresetId":"style_benchmark_editorial","qualityPresetId":"quality_benchmark_v5","cameraPresetId":null,"lightingPresetId":null},"continuity":{"characterIdentity":"locked","outfit":"locked","location":"locked","props":"tracked","screenDirection":"tracked"},"shots":[{"id":"shot_001","index":1,"intent":"The archivist enters the quiet archive room while the ledger remains on its shelf.","rhythmRole":"establishing","direction":{"shotSize":"wide","cameraHeight":"eye level","cameraAngle":"three-quarter angle","viewpoint":"from the doorway","bodyOrientation":"moving toward the interior","pose":"one foot crossing the threshold","action":"entering the archive room","gaze":"directed toward the shelving","expression":"calm concentration","subjectPlacement":"lower center with open room space ahead","depth":"deep view from doorway to shelving","lighting":"soft window light across the floor and shelves","visibilityRequirements":["entry movement","archive shelving","ledger visible on the shelf"]},"continuity":{"location":"quiet archive room","outfitState":"unchanged","props":[{"id":"ledger_001","state":"closed on the middle shelf, visible in the background"}],"screenDirection":"movement from lower frame toward the back","carriesFrom":null},"generation":{"mainPrompt":"quiet archive room, tall wooden shelving, writing desk, soft daylight, vertical composition","supplement":"The closed ledger is visible on the middle shelf.","characters":[{"characterPresetId":"character_archivist","visibleFeaturesPrompt":"","scenePrompt":"entering through the doorway and looking toward the shelving","undesiredPrompt":"","position":{"x":0.48,"y":0.72}}],"undesiredPrompt":"","seed":null}},{"id":"shot_002","index":2,"intent":"The archivist approaches the shelf holding the ledger.","rhythmRole":"transition","direction":{"shotSize":"full-body","cameraHeight":"slightly low","cameraAngle":"side angle","viewpoint":"along the shelving aisle","bodyOrientation":"walking parallel to the shelves","pose":"mid-stride with one hand beginning to rise","action":"approaching the shelf containing the ledger","gaze":"fixed on the ledger","expression":"quiet focus","subjectPlacement":"right third with shelving extending across frame","depth":"layered shelf depth receding behind","lighting":"the same soft window light catches shelf edges","visibilityRequirements":["walking posture","reachable ledger","hand approaching the shelf"]},"continuity":{"location":"quiet archive room","outfitState":"unchanged","props":[{"id":"ledger_001","state":"closed on the middle shelf, within reach"}],"screenDirection":"movement from left toward right along the aisle","carriesFrom":"shot_001"},"generation":{"mainPrompt":"quiet archive room, wooden shelving aisle, writing desk in the distance, soft daylight, vertical composition","supplement":"The closed ledger rests within reach on the middle shelf.","characters":[{"characterPresetId":"character_archivist","visibleFeaturesPrompt":"","scenePrompt":"walking along the shelving aisle, raising one hand toward the ledger","undesiredPrompt":"","position":{"x":0.66,"y":0.61}}],"undesiredPrompt":"","seed":null}},{"id":"shot_003","index":3,"intent":"The archivist removes the ledger from the shelf.","rhythmRole":"action","direction":{"shotSize":"medium","cameraHeight":"shoulder height","cameraAngle":"over-the-shoulder angle","viewpoint":"close to the shelf","bodyOrientation":"facing the shelving","pose":"both hands supporting a book pulled outward","action":"removing the ledger from the middle shelf","gaze":"on the ledger spine","expression":"intent","subjectPlacement":"centered beside the shelf","depth":"shallow depth with shelf rows behind","lighting":"soft side light defines hands and book edges","visibilityRequirements":["both hands on the ledger","ledger clearing the shelf","empty space where the ledger was stored"]},"continuity":{"location":"quiet archive room","outfitState":"unchanged","props":[{"id":"ledger_001","state":"closed and held with both hands, just removed from the middle shelf"}],"screenDirection":"facing toward the shelving","carriesFrom":"shot_002"},"generation":{"mainPrompt":"quiet archive room, wooden shelves, soft daylight, vertical composition","supplement":"Both hands hold the closed ledger as it clears the middle shelf.","characters":[{"characterPresetId":"character_archivist","visibleFeaturesPrompt":"","scenePrompt":"facing the shelf, pulling the closed ledger outward with both hands","undesiredPrompt":"","position":{"x":0.51,"y":0.53}}],"undesiredPrompt":"","seed":null}},{"id":"shot_004","index":4,"intent":"The archivist carries the ledger to the desk and opens it.","rhythmRole":"hero","direction":{"shotSize":"wide","cameraHeight":"slightly high","cameraAngle":"diagonal angle","viewpoint":"from the desk corner","bodyOrientation":"turning toward the desk","pose":"leaning forward with hands separating the covers","action":"setting the ledger on the desk and opening it","gaze":"down at the opening pages","expression":"absorbed","subjectPlacement":"center foreground with desk surface visible","depth":"desk in foreground and shelves in background","lighting":"soft daylight pools across the open desk surface","visibilityRequirements":["ledger on desk","both covers opening","hands at the cover edges","shelves remaining visible"]},"continuity":{"location":"quiet archive room","outfitState":"unchanged","props":[{"id":"ledger_001","state":"open on the writing desk, pages spread beneath both hands"}],"screenDirection":"movement from shelving toward the desk","carriesFrom":"shot_003"},"generation":{"mainPrompt":"quiet archive room, wooden writing desk, shelving in the background, soft daylight, vertical composition","supplement":"The ledger lies open on the desk with both hands separating its covers.","characters":[{"characterPresetId":"character_archivist","visibleFeaturesPrompt":"","scenePrompt":"at the desk, opening the carried ledger with both hands","undesiredPrompt":"","position":{"x":0.49,"y":0.58}}],"undesiredPrompt":"","seed":null}},{"id":"shot_005","index":5,"intent":"The archivist compares the open ledger with archival records on the desk.","rhythmRole":"service","direction":{"shotSize":"medium","cameraHeight":"high angle","cameraAngle":"top-down three-quarter angle","viewpoint":"above the desk surface","bodyOrientation":"seated facing the desk","pose":"one hand holding the ledger page while the other aligns a loose record","action":"comparing entries between the ledger and a record sheet","gaze":"moving between the two documents","expression":"analytical focus","subjectPlacement":"upper center around the desk","depth":"shallow desk-plane depth","lighting":"window light illuminates paper surfaces with gentle shadow","visibilityRequirements":["open ledger text area","separate record sheet","both hands and comparison relationship"]},"continuity":{"location":"quiet archive room","outfitState":"unchanged","props":[{"id":"ledger_001","state":"open on the writing desk, held flat beside a loose archival record"}],"screenDirection":"stationary at the desk facing inward","carriesFrom":"shot_004"},"generation":{"mainPrompt":"quiet archive room, writing desk, open documents, soft daylight, vertical composition","supplement":"One hand holds the open ledger page while the other aligns a separate archival record beside it.","characters":[{"characterPresetId":"character_archivist","visibleFeaturesPrompt":"","scenePrompt":"seated at the desk, comparing the open ledger with a loose archival record","undesiredPrompt":"","position":{"x":0.5,"y":0.43}}],"undesiredPrompt":"","seed":null}},{"id":"shot_006","index":6,"intent":"The archivist writes a note after completing the comparison.","rhythmRole":"resolution","direction":{"shotSize":"close-up","cameraHeight":"desk height","cameraAngle":"side angle","viewpoint":"beside the writing hand","bodyOrientation":"seated facing the desk","pose":"one hand writing while the other steadies the open ledger","action":"writing a note on a small sheet beside the ledger","gaze":"down at the note","expression":"composed satisfaction","subjectPlacement":"lower center with hands and documents dominant","depth":"shallow focus on pen, note, and ledger pages","lighting":"soft side light highlights the pen tip and paper texture","visibilityRequirements":["writing hand","pen touching note","open ledger beside the note","steadying hand visible"]},"continuity":{"location":"quiet archive room","outfitState":"unchanged","props":[{"id":"ledger_001","state":"open on the writing desk beside the note, steadied by one hand"}],"screenDirection":"stationary at the desk facing inward","carriesFrom":"shot_005"},"generation":{"mainPrompt":"quiet archive room, writing desk, open ledger, paper note, soft daylight, vertical composition","supplement":"A pen touches the note sheet beside the open ledger while the other hand steadies the pages.","characters":[{"characterPresetId":"character_archivist","visibleFeaturesPrompt":"","scenePrompt":"writing a note beside the open ledger, one hand using a pen and the other hand steadying the pages","undesiredPrompt":"","position":{"x":0.5,"y":0.66}}],"undesiredPrompt":"","seed":null}}]}